15-12-2025
==========

SQL*Plus: Release 11.2.0.2.0 Production on Mon Dec 15 12:24:45 2025

Copyright (c) 1982, 2014, Oracle.  All rights reserved.

SQL> connect / as sysdba;
Connected.
SQL> create user classdb identified by classdb;

User created.

SQL> connect classdb;
Enter password:
ERROR:
ORA-01017: invalid username/password; logon denied


Warning: You are no longer connected to ORACLE.
SQL> connect classdb;
Enter password:
ERROR:
ORA-01045: user CLASSDB lacks CREATE SESSION privilege; logon denied


SQL> grant all privileges to classdb;
SP2-0640: Not connected
SQL> connect / as sysdba;
Connected.
SQL> grant all privileges to classdb;

Grant succeeded.

SQL> connect classdb;
Enter password:
Connected.
SQL>
========================
17-12-2025
-------

SQL*Plus: Release 11.2.0.2.0 Production on Wed Dec 17 11:51:15 2025

Copyright (c) 1982, 2014, Oracle.  All rights reserved.

SQL> select * from student;
SP2-0640: Not connected
SQL> connect classdb;
Enter password:
Connected.
SQL> select * from student;

       SID SNAME                                              PERCENTAGE
---------- -------------------------------------------------- ----------
       102 Balu                                                    98.99
       101 Krishna                                                 95.33
       103 Ramesh                                                     90
       104 Raji                                                    85.85
       105 Ramu                                                   100.12
       105 Ramu                                                   100.12
       105 Ramu                                                   100.12
       105 Ramu                                                   100.12

8 rows selected.

SQL> show linwsize;
SP2-0158: unknown SHOW option "linwsize"
SQL> show linesize;
linesize 80
SQL> set linesize 150;
SQL> show linesize;
linesize 150
SQL> select * from student;

       SID SNAME                                              PERCENTAGE
---------- -------------------------------------------------- ----------
       102 Balu                                                    98.99
       101 Krishna                                                 95.33
       103 Ramesh                                                     90
       104 Raji                                                    85.85
       105 Ramu                                                   100.12
       105 Ramu                                                   100.12
       105 Ramu                                                   100.12
       105 Ramu                                                   100.12

8 rows selected.

SQL> create table emp (eid varchar2(3),ename varchar2(5),sal number(4));

Table created.

SQL> desc emp;
 Name                                                                                Null?    Type
 ----------------------------------------------------------------------------------- -------- --------------------------------------------------------
 EID                                                                                          VARCHAR2(3)
 ENAME                                                                                        VARCHAR2(5)
 SAL                                                                                          NUMBER(4)

SQL> set linesize 80;
SQL> desc emp;
 Name                                      Null?    Type
 ----------------------------------------- -------- ----------------------------
 EID                                                VARCHAR2(3)
 ENAME                                              VARCHAR2(5)
 SAL                                                NUMBER(4)

SQL> alter table emp modify eid number(3);

Table altered.

SQL> desc emp;
 Name                                      Null?    Type
 ----------------------------------------- -------- ----------------------------
 EID                                                NUMBER(3)
 ENAME                                              VARCHAR2(5)
 SAL                                                NUMBER(4)

SQL> desc stu;
 Name                                      Null?    Type
 ----------------------------------------- -------- ----------------------------
 SID                                                NUMBER(3)
 SNAME                                              VARCHAR2(10)
 PERCENTAGE                                         NUMBER(5,2)

SQL> select * from stu;

       SID SNAME      PERCENTAGE
---------- ---------- ----------
       101 Krishna        999.99
       101 Krishna         999.9

SQL> alter stu emp modify sname number(3);
alter stu emp modify sname number(3)
      *
ERROR at line 1:
ORA-00940: invalid ALTER command


SQL> alter stu modify sname number(3);
alter stu modify sname number(3)
      *
ERROR at line 1:
ORA-00940: invalid ALTER command


SQL> alter table stu  modify sname number(3);
alter table stu  modify sname number(3)
                        *
ERROR at line 1:
ORA-01439: column to be modified must be empty to change datatype


SQL> truncate stu;
truncate stu
           *
ERROR at line 1:
ORA-03290: Invalid truncate command - missing CLUSTER or TABLE keyword


SQL> truncate table stu;

Table truncated.

SQL> desc stu;
 Name                                      Null?    Type
 ----------------------------------------- -------- ----------------------------
 SID                                                NUMBER(3)
 SNAME                                              VARCHAR2(10)
 PERCENTAGE                                         NUMBER(5,2)

SQL> select * from stu;

no rows selected

SQL> alter table stu  modify sname number(3);

Table altered.

SQL> desc stu;
 Name                                      Null?    Type
 ----------------------------------------- -------- ----------------------------
 SID                                                NUMBER(3)
 SNAME                                              NUMBER(3)
 PERCENTAGE                                         NUMBER(5,2)

SQL> desc emp;
 Name                                      Null?    Type
 ----------------------------------------- -------- ----------------------------
 EID                                                NUMBER(3)
 ENAME                                              VARCHAR2(5)
 SAL                                                NUMBER(4)

SQL> alter table emp  modify ename varchar2(20);

Table altered.

SQL> desc emp;
 Name                                      Null?    Type
 ----------------------------------------- -------- ----------------------------
 EID                                                NUMBER(3)
 ENAME                                              VARCHAR2(20)
 SAL                                                NUMBER(4)

SQL> alter table emp  add age number(2);

Table altered.

SQL> desc emp;
 Name                                      Null?    Type
 ----------------------------------------- -------- ----------------------------
 EID                                                NUMBER(3)
 ENAME                                              VARCHAR2(20)
 SAL                                                NUMBER(4)
 AGE                                                NUMBER(2)

SQL> alter table emp rename column eid to emp_id;

Table altered.

SQL> desc emp;
 Name                                      Null?    Type
 ----------------------------------------- -------- ----------------------------
 EMP_ID                                             NUMBER(3)
 ENAME                                              VARCHAR2(20)
 SAL                                                NUMBER(4)
 AGE                                                NUMBER(2)

SQL> rename emp to employee;

Table renamed.

SQL> desc emp;
ERROR:
ORA-04043: object emp does not exist


SQL> desc employee;
 Name                                      Null?    Type
 ----------------------------------------- -------- ----------------------------
 EMP_ID                                             NUMBER(3)
 ENAME                                              VARCHAR2(20)
 SAL                                                NUMBER(4)
 AGE                                                NUMBER(2)

SQL> rename employee to emp;

Table renamed.

SQL> desc employee;
ERROR:
ORA-04043: object employee does not exist


SQL> desc emp;
 Name                                      Null?    Type
 ----------------------------------------- -------- ----------------------------
 EMP_ID                                             NUMBER(3)
 ENAME                                              VARCHAR2(20)
 SAL                                                NUMBER(4)
 AGE                                                NUMBER(2)

SQL> select * from emp;

no rows selected

SQL> truncate table emp;

Table truncated.

SQL> select * from emp;

no rows selected

SQL> insert into emp values(&&emp_id,&&ename,&&sal,&&age);
Enter value for emp_id: 1
Enter value for ename: 'krishna'
Enter value for sal: 5000
Enter value for age: 20
old   1: insert into emp values(&&emp_id,&&ename,&&sal,&&age)
new   1: insert into emp values(1,'krishna',5000,20)

1 row created.

SQL> //
old   1: insert into emp values(&&emp_id,&&ename,&&sal,&&age)
new   1: insert into emp values(1,'krishna',5000,20)

1 row created.

SQL> //
old   1: insert into emp values(&&emp_id,&&ename,&&sal,&&age)
new   1: insert into emp values(1,'krishna',5000,20)

1 row created.

SQL> //
old   1: insert into emp values(&&emp_id,&&ename,&&sal,&&age)
new   1: insert into emp values(1,'krishna',5000,20)

1 row created.

SQL> //
old   1: insert into emp values(&&emp_id,&&ename,&&sal,&&age)
new   1: insert into emp values(1,'krishna',5000,20)

1 row created.

SQL> //
old   1: insert into emp values(&&emp_id,&&ename,&&sal,&&age)
new   1: insert into emp values(1,'krishna',5000,20)

1 row created.

SQL> select * from emp;

    EMP_ID ENAME                       SAL        AGE
---------- -------------------- ---------- ----------
         1 krishna                    5000         20
         1 krishna                    5000         20
         1 krishna                    5000         20
         1 krishna                    5000         20
         1 krishna                    5000         20
         1 krishna                    5000         20

6 rows selected.

SQL> insert into emp(ename,sal) values('Ramesh',6000);

1 row created.

SQL> select * from emp;

    EMP_ID ENAME                       SAL        AGE
---------- -------------------- ---------- ----------
         1 krishna                    5000         20
         1 krishna                    5000         20
         1 krishna                    5000         20
         1 krishna                    5000         20
         1 krishna                    5000         20
         1 krishna                    5000         20
           Ramesh                     6000

7 rows selected.

SQL> truncate table emp;

Table truncated.

SQL> select * from emp;

no rows selected

SQL> desc emp;
 Name                                      Null?    Type
 ----------------------------------------- -------- ----------------------------
 EMP_ID                                             NUMBER(3)
 ENAME                                              VARCHAR2(20)
 SAL                                                NUMBER(4)
 AGE                                                NUMBER(2)

SQL> create table emp1 as emp;
create table emp1 as emp
                     *
ERROR at line 1:
ORA-00928: missing SELECT keyword


SQL> create table emp1 as select emp;
create table emp1 as select emp
                              *
ERROR at line 1:
ORA-00923: FROM keyword not found where expected


SQL> create table emp1 as select * from emp;

Table created.

SQL> desc emp1;
 Name                                      Null?    Type
 ----------------------------------------- -------- ----------------------------
 EMP_ID                                             NUMBER(3)
 ENAME                                              VARCHAR2(20)
 SAL                                                NUMBER(4)
 AGE                                                NUMBER(2)

SQL> desc emp;
 Name                                      Null?    Type
 ----------------------------------------- -------- ----------------------------
 EMP_ID                                             NUMBER(3)
 ENAME                                              VARCHAR2(20)
 SAL                                                NUMBER(4)
 AGE                                                NUMBER(2)

SQL> drop table emp1;

Table dropped.

SQL> desc emp1;
ERROR:
ORA-04043: object emp1 does not exist


SQL> insert into emp(ename,sal) values('Ramesh',6000);

1 row created.

SQL> insert into emp(ename,sal) values('Ramesh',6000);

1 row created.

SQL> insert into emp(ename,sal) values('Ramesh',6000);

1 row created.

SQL> insert into emp(ename,sal) values('Ramesh',6000);

1 row created.

SQL> insert into emp(ename,sal) values('Ramesh',6000);

1 row created.

SQL> select * from emp;

    EMP_ID ENAME                       SAL        AGE
---------- -------------------- ---------- ----------
           Ramesh                     6000
           Ramesh                     6000
           Ramesh                     6000
           Ramesh                     6000
           Ramesh                     6000

SQL> insert into emp(ename,sal) values('Ramesh',5000);

1 row created.

SQL> insert into emp(ename,sal) values('Ramesh',4000);

1 row created.

SQL> insert into emp(ename,sal) values('Ramesh',3000);

1 row created.

SQL> select * from emp;

    EMP_ID ENAME                       SAL        AGE
---------- -------------------- ---------- ----------
           Ramesh                     6000
           Ramesh                     6000
           Ramesh                     6000
           Ramesh                     6000
           Ramesh                     6000
           Ramesh                     5000
           Ramesh                     4000
           Ramesh                     3000

8 rows selected.

SQL> select ename from emp;

ENAME
--------------------
Ramesh
Ramesh
Ramesh
Ramesh
Ramesh
Ramesh
Ramesh
Ramesh

8 rows selected.

SQL> select ename,sal from emp;

ENAME                       SAL
-------------------- ----------
Ramesh                     6000
Ramesh                     6000
Ramesh                     6000
Ramesh                     6000
Ramesh                     6000
Ramesh                     5000
Ramesh                     4000
Ramesh                     3000

8 rows selected.

SQL> select ename,sal from emp where sal<=5000;

ENAME                       SAL
-------------------- ----------
Ramesh                     5000
Ramesh                     4000
Ramesh                     3000

SQL> select ename,sal from emp where sal<=5000 & ename='Ramesh';
old   1: select ename,sal from emp where sal<=5000 & ename='Ramesh'
new   1: select ename,sal from emp where sal<=5000 'krishna'='Ramesh'
select ename,sal from emp where sal<=5000 'krishna'='Ramesh'
                                          *
ERROR at line 1:
ORA-00933: SQL command not properly ended


SQL> select ename,sal from emp where sal<=5000 && ename='Ramesh';
old   1: select ename,sal from emp where sal<=5000 && ename='Ramesh'
new   1: select ename,sal from emp where sal<=5000 'krishna'='Ramesh'
select ename,sal from emp where sal<=5000 'krishna'='Ramesh'
                                          *
ERROR at line 1:
ORA-00933: SQL command not properly ended


SQL> select ename,sal from emp where sal<=5000 and ename='Ramesh';

ENAME                       SAL
-------------------- ----------
Ramesh                     5000
Ramesh                     4000
Ramesh                     3000

SQL> select ename,sal from emp where sal<=5000 or ename='Ramesh';

ENAME                       SAL
-------------------- ----------
Ramesh                     6000
Ramesh                     6000
Ramesh                     6000
Ramesh                     6000
Ramesh                     6000
Ramesh                     5000
Ramesh                     4000
Ramesh                     3000

8 rows selected.

SQL> select ename,sal from emp where sal<=5000 or ename='Krishna';

ENAME                       SAL
-------------------- ----------
Ramesh                     5000
Ramesh                     4000
Ramesh                     3000

SQL> select ename,sal from emp where sal<=5000 and ename='Krishna';

no rows selected

SQL> select * from emp where sal<=5000 and ename='Krishna';

no rows selected

SQL> select * from emp;

    EMP_ID ENAME                       SAL        AGE
---------- -------------------- ---------- ----------
           Ramesh                     6000
           Ramesh                     6000
           Ramesh                     6000
           Ramesh                     6000
           Ramesh                     6000
           Ramesh                     5000
           Ramesh                     4000
           Ramesh                     3000

8 rows selected.

SQL> update table emp set emp_id=101;
update table emp set emp_id=101
       *
ERROR at line 1:
ORA-00903: invalid table name


SQL> update emp set emp_id=101;

8 rows updated.

SQL> select * from emp;

    EMP_ID ENAME                       SAL        AGE
---------- -------------------- ---------- ----------
       101 Ramesh                     6000
       101 Ramesh                     6000
       101 Ramesh                     6000
       101 Ramesh                     6000
       101 Ramesh                     6000
       101 Ramesh                     5000
       101 Ramesh                     4000
       101 Ramesh                     3000

8 rows selected.

SQL> update emp set ename='Krishna';

8 rows updated.

SQL> select * from emp;

    EMP_ID ENAME                       SAL        AGE
---------- -------------------- ---------- ----------
       101 Krishna                    6000
       101 Krishna                    6000
       101 Krishna                    6000
       101 Krishna                    6000
       101 Krishna                    6000
       101 Krishna                    5000
       101 Krishna                    4000
       101 Krishna                    3000

8 rows selected.

SQL> update emp set ename='Krishna' where emp_id=102;

0 rows updated.

SQL> update emp set ename='Krishna' where sal=3000;

1 row updated.

SQL> update emp set eid=104 where sal=3000;
update emp set eid=104 where sal=3000
               *
ERROR at line 1:
ORA-00904: "EID": invalid identifier


SQL> update emp set emp_id=104 where sal=3000;

1 row updated.

SQL> select * from emp;

    EMP_ID ENAME                       SAL        AGE
---------- -------------------- ---------- ----------
       101 Krishna                    6000
       101 Krishna                    6000
       101 Krishna                    6000
       101 Krishna                    6000
       101 Krishna                    6000
       101 Krishna                    5000
       101 Krishna                    4000
       104 Krishna                    3000

8 rows selected.

SQL> update emp set ename='Ramesh' where sal=3000;

1 row updated.

SQL> select * from emp;

    EMP_ID ENAME                       SAL        AGE
---------- -------------------- ---------- ----------
       101 Krishna                    6000
       101 Krishna                    6000
       101 Krishna                    6000
       101 Krishna                    6000
       101 Krishna                    6000
       101 Krishna                    5000
       101 Krishna                    4000
       104 Ramesh                     3000

8 rows selected.

SQL> update emp set emp_id=103 where sal=4000;

1 row updated.

SQL> update emp set ename='Murali' where sal=5000;

1 row updated.

SQL> update emp set emp_id=102 where sal=5000;

1 row updated.

SQL> select * from emp;

    EMP_ID ENAME                       SAL        AGE
---------- -------------------- ---------- ----------
       101 Krishna                    6000
       101 Krishna                    6000
       101 Krishna                    6000
       101 Krishna                    6000
       101 Krishna                    6000
       102 Murali                     5000
       103 Krishna                    4000
       104 Ramesh                     3000

8 rows selected.

SQL> update emp set ename='Suman' where emp_id=103;

1 row updated.

SQL> select * from emp;

    EMP_ID ENAME                       SAL        AGE
---------- -------------------- ---------- ----------
       101 Krishna                    6000
       101 Krishna                    6000
       101 Krishna                    6000
       101 Krishna                    6000
       101 Krishna                    6000
       102 Murali                     5000
       103 Suman                      4000
       104 Ramesh                     3000

8 rows selected.

SQL> update emp set ename='Mahesh', ename='Suresh' where emp_id=101;
update emp set ename='Mahesh', ename='Suresh' where emp_id=101
                               *
ERROR at line 1:
ORA-00957: duplicate column name


SQL> update emp set ename='Mahesh'and emp_id=105 where emp_id=101;
update emp set ename='Mahesh'and emp_id=105 where emp_id=101
                             *
ERROR at line 1:
ORA-00933: SQL command not properly ended


SQL> select * from emp;

    EMP_ID ENAME                       SAL        AGE
---------- -------------------- ---------- ----------
       101 Krishna                    6000
       101 Krishna                    6000
       101 Krishna                    6000
       101 Krishna                    6000
       101 Krishna                    6000
       102 Murali                     5000
       103 Suman                      4000
       104 Ramesh                     3000

8 rows selected.

SQL> commit;

Commit complete.

SQL> delete table emp where emp_id=101;
delete table emp where emp_id=101
       *
ERROR at line 1:
ORA-00903: invalid table name


SQL> delete emp where emp_id=101;

5 rows deleted.

SQL> select * from emp;

    EMP_ID ENAME                       SAL        AGE
---------- -------------------- ---------- ----------
       102 Murali                     5000
       103 Suman                      4000
       104 Ramesh                     3000

SQL> rollback;

Rollback complete.

SQL> select * from emp;

    EMP_ID ENAME                       SAL        AGE
---------- -------------------- ---------- ----------
       101 Krishna                    6000
       101 Krishna                    6000
       101 Krishna                    6000
       101 Krishna                    6000
       101 Krishna                    6000
       102 Murali                     5000
       103 Suman                      4000
       104 Ramesh                     3000

8 rows selected.

SQL> delete table emp where emp_id=101;
delete table emp where emp_id=101
       *
ERROR at line 1:
ORA-00903: invalid table name


SQL> delete emp where emp_id=101;

5 rows deleted.

SQL> select * from emp;

    EMP_ID ENAME                       SAL        AGE
---------- -------------------- ---------- ----------
       102 Murali                     5000
       103 Suman                      4000
       104 Ramesh                     3000

SQL> commit;

Commit complete.

SQL> rollback;

Rollback complete.

SQL> select * from emp;

    EMP_ID ENAME                       SAL        AGE
---------- -------------------- ---------- ----------
       102 Murali                     5000
       103 Suman                      4000
       104 Ramesh                     3000

SQL> insert into emp values(101,'Mahesh',6000,55);

1 row created.

SQL> select * from emp;

    EMP_ID ENAME                       SAL        AGE
---------- -------------------- ---------- ----------
       102 Murali                     5000
       103 Suman                      4000
       104 Ramesh                     3000
       101 Mahesh                     6000         55

SQL> insert into emp values(102,'Srinivas',7000,45);

1 row created.

SQL> update table emp set age=25 where emp_id=102;
update table emp set age=25 where emp_id=102
       *
ERROR at line 1:
ORA-00903: invalid table name


SQL> update emp set age=25 where emp_id=102;

2 rows updated.

SQL> select * from emp;

    EMP_ID ENAME                       SAL        AGE
---------- -------------------- ---------- ----------
       102 Murali                     5000         25
       103 Suman                      4000
       104 Ramesh                     3000
       101 Mahesh                     6000         55
       102 Srinivas                   7000         25

SQL> update table emp set age=25 where emp_id=102,104;
update table emp set age=25 where emp_id=102,104
       *
ERROR at line 1:
ORA-00903: invalid table name


SQL> update emp set age=25 where emp_id=102,104;
update emp set age=25 where emp_id=102,104
                                      *
ERROR at line 1:
ORA-00933: SQL command not properly ended


SQL> update emp set age=25 where emp_id=102 and 104;
update emp set age=25 where emp_id=102 and 104
                                             *
ERROR at line 1:
ORA-00920: invalid relational operator


SQL> update emp set age=25 where emp_id=102 and emp_id=104;

0 rows updated.

SQL> select * from emp;

    EMP_ID ENAME                       SAL        AGE
---------- -------------------- ---------- ----------
       102 Murali                     5000         25
       103 Suman                      4000
       104 Ramesh                     3000
       101 Mahesh                     6000         55
       102 Srinivas                   7000         25

SQL> rollback;

Rollback complete.

SQL> select * from emp;

    EMP_ID ENAME                       SAL        AGE
---------- -------------------- ---------- ----------
       102 Murali                     5000
       103 Suman                      4000
       104 Ramesh                     3000

SQL> savepoint e1;

Savepoint created.

SQL> insert into emp values(101,'Mahesh',6000,55);

1 row created.

SQL> select * from emp;

    EMP_ID ENAME                       SAL        AGE
---------- -------------------- ---------- ----------
       102 Murali                     5000
       103 Suman                      4000
       104 Ramesh                     3000
       101 Mahesh                     6000         55

SQL> savepoint e2;

Savepoint created.

SQL> update emp set age=25 where emp_id=102;

1 row updated.

SQL> select * from emp;

    EMP_ID ENAME                       SAL        AGE
---------- -------------------- ---------- ----------
       102 Murali                     5000         25
       103 Suman                      4000
       104 Ramesh                     3000
       101 Mahesh                     6000         55

SQL> savepoint e3;

Savepoint created.

SQL> delete emp where emp_id=103;

1 row deleted.

SQL> select * from emp;

    EMP_ID ENAME                       SAL        AGE
---------- -------------------- ---------- ----------
       102 Murali                     5000         25
       104 Ramesh                     3000
       101 Mahesh                     6000         55

SQL> rollback e3;
rollback e3
         *
ERROR at line 1:
ORA-02181: invalid option to ROLLBACK WORK


SQL> rollback e3;
rollback e3
         *
ERROR at line 1:
ORA-02181: invalid option to ROLLBACK WORK


SQL> rollback savepoint e3;
rollback savepoint e3
         *
ERROR at line 1:
ORA-02181: invalid option to ROLLBACK WORK


SQL> rollback savepoint e3;
rollback savepoint e3
         *
ERROR at line 1:
ORA-02181: invalid option to ROLLBACK WORK


SQL> rollback e3;
rollback e3
         *
ERROR at line 1:
ORA-02181: invalid option to ROLLBACK WORK


SQL> rollback e2;
rollback e2
         *
ERROR at line 1:
ORA-02181: invalid option to ROLLBACK WORK


SQL> rollback to e3;

Rollback complete.

SQL> select * from emp;

    EMP_ID ENAME                       SAL        AGE
---------- -------------------- ---------- ----------
       102 Murali                     5000         25
       103 Suman                      4000
       104 Ramesh                     3000
       101 Mahesh                     6000         55

SQL> rollback to e2;

Rollback complete.

SQL> select * from emp;

    EMP_ID ENAME                       SAL        AGE
---------- -------------------- ---------- ----------
       102 Murali                     5000
       103 Suman                      4000
       104 Ramesh                     3000
       101 Mahesh                     6000         55

SQL> rollback to e1;

Rollback complete.

SQL> select * from emp;

    EMP_ID ENAME                       SAL        AGE
---------- -------------------- ---------- ----------
       102 Murali                     5000
       103 Suman                      4000
       104 Ramesh                     3000

SQL>
============================================
18/12/2025
--------

SQL*Plus: Release 11.2.0.2.0 Production on Thu Dec 18 11:44:42 2025

Copyright (c) 1982, 2014, Oracle.  All rights reserved.

SQL> connect classdb;
Enter password:
Connected.
SQL> create table emp1(eid number(3),ename varchar(10),dob date);

Table created.

SQL> desc emp1;
 Name                                      Null?    Type
 ----------------------------------------- -------- ----------------------------
 EID                                                NUMBER(3)
 ENAME                                              VARCHAR2(10)
 DOB                                                DATE

SQL> insert into emp1 values(1,'Krishna','15/dec/2025');

1 row created.

SQL> select * from emp1;

       EID ENAME      DOB
---------- ---------- ---------
         1 Krishna    15-DEC-25

SQL> insert into emp1 values(1,'Krishna','15/12/2025');
insert into emp1 values(1,'Krishna','15/12/2025')
                                    *
ERROR at line 1:
ORA-01843: not a valid month


SQL> insert into emp1 values(1,'Krishna','15/jan/2025');

1 row created.

SQL> select * from emp1;

       EID ENAME      DOB
---------- ---------- ---------
         1 Krishna    15-DEC-25
         1 Krishna    15-JAN-25

SQL> create table emp1(eid number(3),ename varchar(10),dob timestamp);
create table emp1(eid number(3),ename varchar(10),dob timestamp)
             *
ERROR at line 1:
ORA-00955: name is already used by an existing object


SQL> drop table emp1;

Table dropped.

SQL> create table emp1(eid number(3),ename varchar(10),dob timestamp);

Table created.

SQL> desc emp1;
 Name                                      Null?    Type
 ----------------------------------------- -------- ----------------------------
 EID                                                NUMBER(3)
 ENAME                                              VARCHAR2(10)
 DOB                                                TIMESTAMP(6)

SQL> insert into emp1 values(1,'Krishna','15/jan/2025');

1 row created.

SQL> select * from emp1;

       EID ENAME
---------- ----------
DOB
---------------------------------------------------------------------------
         1 Krishna
15-JAN-25 12.00.00.000000 AM


SQL> set linesize 150;
SQL> select * from emp1;

       EID ENAME      DOB
---------- ---------- ---------------------------------------------------------------------------
         1 Krishna    15-JAN-25 12.00.00.000000 AM

SQL> set linesize 250;
SQL> select * from emp1;

       EID ENAME      DOB
---------- ---------- ---------------------------------------------------------------------------
         1 Krishna    15-JAN-25 12.00.00.000000 AM

SQL> insert into emp1 values(1,'Krishna','15/jan/2025 10:50:30');

1 row created.

SQL> select * from emp1;

       EID ENAME      DOB
---------- ---------- ---------------------------------------------------------------------------
         1 Krishna    15-JAN-25 12.00.00.000000 AM
         1 Krishna    15-JAN-25 10.50.30.000000 AM

SQL> insert into emp1 values(1,'Krishna','15/jan/2025 10:50:30 50 PM');
insert into emp1 values(1,'Krishna','15/jan/2025 10:50:30 50 PM')
                                    *
ERROR at line 1:
ORA-01855: AM/A.M. or PM/P.M. required


SQL> insert into emp1 values(1,'Krishna','15/jan/2025 10:50:30 50 P.M');
insert into emp1 values(1,'Krishna','15/jan/2025 10:50:30 50 P.M')
                                    *
ERROR at line 1:
ORA-01855: AM/A.M. or PM/P.M. required


SQL> insert into emp1 values(1,'Krishna','15/jan/2025 10:50:30 PM');

1 row created.

SQL> select * from emp1;

       EID ENAME      DOB
---------- ---------- ---------------------------------------------------------------------------
         1 Krishna    15-JAN-25 12.00.00.000000 AM
         1 Krishna    15-JAN-25 10.50.30.000000 AM
         1 Krishna    15-JAN-25 10.50.30.000000 PM

SQL> select sysdate from dual;

SYSDATE
---------
18-DEC-25

SQL> select sysdate from emp1;

SYSDATE
---------
18-DEC-25
18-DEC-25
18-DEC-25

SQL> select sysdate from emp1;

SYSDATE
---------
18-DEC-25
18-DEC-25
18-DEC-25

SQL> select * from emp1;

       EID ENAME      DOB
---------- ---------- ---------------------------------------------------------------------------
         1 Krishna    15-JAN-25 12.00.00.000000 AM
         1 Krishna    15-JAN-25 10.50.30.000000 AM
         1 Krishna    15-JAN-25 10.50.30.000000 PM

SQL> select * from dual;

D
-
X

SQL> select 10+20 from dual;

     10+20
----------
        30

SQL> select 10+20 from emp1;

     10+20
----------
        30
        30
        30

SQL> select 10+20 from student;

     10+20
----------
        30
        30
        30
        30
        30
        30
        30
        30

8 rows selected.

SQL> select 10+20 from dual;

     10+20
----------
        30

SQL> select 10+20  Addition from dual;

  ADDITION
----------
        30

SQL> select sysdate from dual;

SYSDATE
---------
18-DEC-25

SQL> select systimestamp from dual;

SYSTIMESTAMP
---------------------------------------------------------------------------
18-DEC-25 11.53.18.672000 AM +05:30

SQL> create table emp1(eid number(3) not null,ename varchar2(10));
create table emp1(eid number(3) not null,ename varchar2(10))
             *
ERROR at line 1:
ORA-00955: name is already used by an existing object


SQL> drop table emp1;

Table dropped.

SQL> create table emp1(eid number(3) not null,ename varchar2(10));

Table created.

SQL> desc emp1;
 Name                                                                                Null?     Type
 ----------------------------------------------------------------------------------------------------------------------------------------------- -------- ------------------------------------------------------------------------------------------------
 EID                                                                                 NOT NULL NUMBER(3)
 ENAME                                                                                VARCHAR2(10)

SQL> set linesize 80;
SQL> desc emp1;
 Name                                      Null?    Type
 ----------------------------------------- -------- ----------------------------
 EID                                       NOT NULL NUMBER(3)
 ENAME                                              VARCHAR2(10)

SQL> insert into emp1(1,'fhfh');
insert into emp1(1,'fhfh')
                 *
ERROR at line 1:
ORA-00928: missing SELECT keyword


SQL> insert into emp1 values(1,'fhfh');

1 row created.

SQL> select * from emp1;

       EID ENAME
---------- ----------
         1 fhfh

SQL> insert into emp1(ename) values('hgjhk');
insert into emp1(ename) values('hgjhk')
*
ERROR at line 1:
ORA-01400: cannot insert NULL into ("CLASSDB"."EMP1"."EID")


SQL> drop table emp1;

Table dropped.

SQL> create table emp1(eid number(3) unique,ename varchar2(10));

Table created.

SQL> desc emp1;
 Name                                      Null?    Type
 ----------------------------------------- -------- ----------------------------
 EID                                                NUMBER(3)
 ENAME                                              VARCHAR2(10)

SQL> insert into emp1(1,'fhfh');
insert into emp1(1,'fhfh')
                 *
ERROR at line 1:
ORA-00928: missing SELECT keyword


SQL> insert into emp1 values(1,'fhfh');

1 row created.

SQL> select * from emp1;

       EID ENAME
---------- ----------
         1 fhfh

SQL> insert into emp1 values(1,'fhfh');
insert into emp1 values(1,'fhfh')
*
ERROR at line 1:
ORA-00001: unique constraint (CLASSDB.SYS_C007004) violated


SQL> insert into emp1(ename) values('hgjhk');

1 row created.

SQL> select * from emp1;

       EID ENAME
---------- ----------
         1 fhfh
           hgjhk

SQL> drop table emp1;

Table dropped.

SQL> create table emp1(eid number(3) primary key,ename varchar2(10) not null,sal number(5) unique);

Table created.

SQL> desc emp1;
 Name                                      Null?    Type
 ----------------------------------------- -------- ----------------------------
 EID                                       NOT NULL NUMBER(3)
 ENAME                                     NOT NULL VARCHAR2(10)
 SAL                                                NUMBER(5)

SQL> insert into emp1 values(1,'fhfh',5000);

1 row created.

SQL> select * from emp1;

       EID ENAME             SAL
---------- ---------- ----------
         1 fhfh             5000

SQL> insert into emp1 values(1,'fhfh',5000);
insert into emp1 values(1,'fhfh',5000)
*
ERROR at line 1:
ORA-00001: unique constraint (CLASSDB.SYS_C007006) violated


SQL> insert into emp1(ename,sal) values('hgjhk',6000);
insert into emp1(ename,sal) values('hgjhk',6000)
*
ERROR at line 1:
ORA-01400: cannot insert NULL into ("CLASSDB"."EMP1"."EID")


SQL> insert into emp1(eid,sal) values(2,6000);
insert into emp1(eid,sal) values(2,6000)
*
ERROR at line 1:
ORA-01400: cannot insert NULL into ("CLASSDB"."EMP1"."ENAME")


SQL> insert into emp1 values(2,'fhfh',5000);
insert into emp1 values(2,'fhfh',5000)
*
ERROR at line 1:
ORA-00001: unique constraint (CLASSDB.SYS_C007007) violated


SQL> create table emp2(eid number(3) primary key,ename varchar2(10) not null,sal number(5) unique check (sal>=5000));

Table created.

SQL> select * from emp2;

no rows selected

SQL> insert into emp2 values(1,'krishna',4000);
insert into emp2 values(1,'krishna',4000)
*
ERROR at line 1:
ORA-02290: check constraint (CLASSDB.SYS_C007009) violated


SQL> insert into emp2 values(1,'krishna',5000);

1 row created.

SQL> insert into emp2 values(1,'krishna',6000);
insert into emp2 values(1,'krishna',6000)
*
ERROR at line 1:
ORA-00001: unique constraint (CLASSDB.SYS_C007010) violated


SQL> insert into emp2 values(2,'krishna',6000);

1 row created.

SQL> select * from emp2;

       EID ENAME             SAL
---------- ---------- ----------
         1 krishna          5000
         2 krishna          6000

SQL> create table emp3(eid number(3) primary key,ename varchar2(10) not null,gender default 'F');
create table emp3(eid number(3) primary key,ename varchar2(10) not null,gender default 'F')
                                                                        *
ERROR at line 1:
ORA-02263: need to specify the datatype for this column


SQL> create table emp3(eid number(3) primary key,ename varchar2(10) not null,gender varchar2 default 'F');
create table emp3(eid number(3) primary key,ename varchar2(10) not null,gender varchar2 default 'F')
                                                                                        *
ERROR at line 1:
ORA-00906: missing left parenthesis


SQL> create table emp3(eid number(3) primary key,ename varchar2(10) not null,gender varchar2(2) default 'F');

Table created.

SQL> desc emp3;
 Name                                      Null?    Type
 ----------------------------------------- -------- ----------------------------
 EID                                       NOT NULL NUMBER(3)
 ENAME                                     NOT NULL VARCHAR2(10)
 GENDER                                             VARCHAR2(2)

SQL> insert into emp3 values(2,'krishna','M');

1 row created.

SQL> select * from emp3;

       EID ENAME      GE
---------- ---------- --
         2 krishna    M

SQL> insert into emp3(eid,ename) values(3,'sdsfds'));
insert into emp3(eid,ename) values(3,'sdsfds'))
                                              *
ERROR at line 1:
ORA-00933: SQL command not properly ended


SQL> insert into emp3(eid,ename) values(3,'sdsfds');

1 row created.

SQL> select * from emp3;

       EID ENAME      GE
---------- ---------- --
         2 krishna    M
         3 sdsfds     F

SQL> desc emp1;
 Name                                      Null?    Type
 ----------------------------------------- -------- ----------------------------
 EID                                       NOT NULL NUMBER(3)
 ENAME                                     NOT NULL VARCHAR2(10)
 SAL                                                NUMBER(5)

SQL> insert into emp1(eid,ename) values(3,'sdsfds');

1 row created.

SQL> select * from emp1;

       EID ENAME             SAL
---------- ---------- ----------
         1 fhfh             5000
         3 sdsfds

SQL> insert into emp1 values(2,'krishna');
insert into emp1 values(2,'krishna')
            *
ERROR at line 1:
ORA-00947: not enough values


SQL> insert into emp3 values(5,'mmmm');
insert into emp3 values(5,'mmmm')
            *
ERROR at line 1:
ORA-00947: not enough values


SQL> create table emp4(eid number(3),ename varchar2(10),doj date deafult sysdate);
create table emp4(eid number(3),ename varchar2(10),doj date deafult sysdate)
                                                            *
ERROR at line 1:
ORA-00907: missing right parenthesis


SQL> create table emp4(eid number(3),ename varchar2(10),doj deafult sysdate);
create table emp4(eid number(3),ename varchar2(10),doj deafult sysdate)
                                                               *
ERROR at line 1:
ORA-00907: missing right parenthesis


SQL> create table emp4(eid number(3),ename varchar2(10),doj date (deafult sysdate));
create table emp4(eid number(3),ename varchar2(10),doj date (deafult sysdate))
                                                            *
ERROR at line 1:
ORA-00907: missing right parenthesis


SQL> create table emp4(eid number(3),ename varchar2(10),doj date default sysdate);

Table created.

SQL> desc emp4;
 Name                                      Null?    Type
 ----------------------------------------- -------- ----------------------------
 EID                                                NUMBER(3)
 ENAME                                              VARCHAR2(10)
 DOJ                                                DATE

SQL> insert into emp4(eid,ename) values(1,'wdwdsd');

1 row created.

SQL> select * from emp4;

       EID ENAME      DOJ
---------- ---------- ---------
         1 wdwdsd     18-DEC-25

SQL> select * from dual
  2  ;

D
-
X

SQL> select * from emp4;

       EID ENAME      DOJ
---------- ---------- ---------
         1 wdwdsd     18-DEC-25

SQL> show user;
USER is "CLASSDB"
SQL> select user from emp4;

USER
------------------------------
CLASSDB

SQL> select user from emp3;

USER
------------------------------
CLASSDB
CLASSDB

SQL> select user from dual;

USER
------------------------------
CLASSDB

SQL> select 30+20+10 from emp4;

  30+20+10
----------
        60

SQL> select 30+20+10 from emp2;

  30+20+10
----------
        60
        60

SQL> select 30+20+10 from dual;

  30+20+10
----------
        60

SQL> select * from emp4;

       EID ENAME      DOJ
---------- ---------- ---------
         1 wdwdsd     18-DEC-25

SQL> select 30+20+10 from dual;

  30+20+10
----------
        60

SQL> truncate emp4;
truncate emp4
            *
ERROR at line 1:
ORA-03290: Invalid truncate command - missing CLUSTER or TABLE keyword


SQL> truncate table  emp4;

Table truncated.

SQL> select * from emp4;

no rows selected

SQL> select 30+20+10 from emp4;

no rows selected

SQL> select 30+20+10 from dual;

  30+20+10
----------
        60

SQL> select * from dual;

D
-
X

SQL> select 30+20+10 from dual;

  30+20+10
----------
        60

SQL> select 30+20+10 Addtion from dual;

   ADDTION
----------
        60

SQL> select 30-20-10 Substraction from dual;

SUBSTRACTION
------------
           0

SQL> select 30+20-10 Substraction from dual;

SUBSTRACTION
------------
          40

SQL> select 30+20-10*20/2 Arthametic from dual;

ARTHAMETIC
----------
       -50

SQL> select (30+20-10*20/2)%5 Arthametic from dual;
select (30+20-10*20/2)%5 Arthametic from dual
                      *
ERROR at line 1:
ORA-00911: invalid character


SQL> select 30+20-10*20/2%5 Arthametic from dual;
select 30+20-10*20/2%5 Arthametic from dual
                    *
ERROR at line 1:
ORA-00911: invalid character


SQL> select 30+20-10*20/2% Arthametic from dual;
select 30+20-10*20/2% Arthametic from dual
                    *
ERROR at line 1:
ORA-00911: invalid character


SQL> select (30+20-10*20/2)% Arthametic from dual;
select (30+20-10*20/2)% Arthametic from dual
                      *
ERROR at line 1:
ORA-00911: invalid character


SQL> select (30+20-10*20/2)/2 Arthametic from dual;

ARTHAMETIC
----------
       -25

SQL>
